{
  "body_identity_sha256": "ed4b000260e5e5598ea00848b6f664a828a241e1791afa292e12b8db54d1a993",
  "confidence": 1,
  "content_sha256": "c7a7ac08a93afdc2a3fe6eb27a555ecb3d3de833d3e7917a01ff04a483f4b1f9",
  "correctives_enabled": true,
  "joint_rotations_xyzw": [
    [
      0,
      0,
      0,
      1
    ],
    [
      0,
      0,
      0,
      1
    ],
    [
      0,
      0,
      0,
      1
    ],
    [
      0,
      0,
      0,
      1
    ],
    [
      0,
      0,
      0,
      1
    ],
    [
      0,
      0,
      0,
      1
    ],
    [
      0,
      0,
      0,
      1
    ],
    [
      0,
      0,
      0,
      1
    ],
    [
      0,
      0,
      0,
      1
    ],
    [
      0,
      0,
      0,
      1
    ],
    [
      0,
      0,
      0,
      1
    ],
    [
      0,
      0,
      0,
      1
    ],
    [
      0,
      0,
      0,
      1
    ],
    [
      0,
      0,
      0,
      1
    ],
    [
      0,
      0,
      0,
      1
    ],
    [
      0,
      0,
      0,
      1
    ],
    [
      0,
      0,
      0,
      1
    ],
    [
      0,
      0,
      0,
      1
    ],
    [
      0,
      0,
      0,
      1
    ],
    [
      0,
      0,
      0,
      1
    ],
    [
      0,
      0,
      0,
      1
    ],
    [
      0,
      0,
      0,
      1
    ],
    [
      0,
      0,
      0,
      1
    ],
    [
      0,
      0,
      0,
      1
    ],
    [
      0,
      0,
      0,
      1
    ],
    [
      0,
      0,
      0,
      1
    ],
    [
      0,
      0,
      0,
      1
    ],
    [
      0,
      0,
      0,
      1
    ],
    [
      0,
      0,
      0,
      1
    ],
    [
      0,
      0,
      0,
      1
    ],
    [
      0,
      0,
      0,
      1
    ],
    [
      0,
      0,
      0,
      1
    ],
    [
      0,
      0,
      0,
      1
    ],
    [
      0,
      0,
      0,
      1
    ],
    [
      0,
      0,
      0,
      1
    ],
    [
      0,
      0,
      0,
      1
    ],
    [
      0,
      0,
      0,
      1
    ],
    [
      0,
      0,
      0,
      1
    ],
    [
      0,
      0,
      0,
      1
    ],
    [
      0,
      0,
      0,
      1
    ],
    [
      0,
      0,
      0,
      1
    ],
    [
      0,
      0,
      0,
      1
    ],
    [
      0,
      0,
      0,
      1
    ],
    [
      0,
      0,
      0,
      1
    ],
    [
      0,
      0,
      0,
      1
    ],
    [
      0,
      0,
      0,
      1
    ],
    [
      0,
      0,
      0,
      1
    ],
    [
      0,
      0,
      0,
      1
    ],
    [
      0,
      0,
      0,
      1
    ],
    [
      0,
      0,
      0,
      1
    ],
    [
      0,
      0,
      0,
      1
    ],
    [
      0,
      0,
      0,
      1
    ],
    [
      0,
      0,
      0,
      1
    ],
    [
      0,
      0,
      0,
      1
    ],
    [
      0,
      0,
      0,
      1
    ],
    [
      0,
      0,
      0,
      1
    ],
    [
      0,
      0,
      0,
      1
    ],
    [
      0,
      0,
      0,
      1
    ],
    [
      0,
      0,
      0,
      1
    ],
    [
      0,
      0,
      0,
      1
    ],
    [
      0,
      0,
      0,
      1
    ],
    [
      0,
      0,
      0,
      1
    ],
    [
      0,
      0,
      0,
      1
    ],
    [
      0,
      0,
      0,
      1
    ],
    [
      0,
      0,
      0,
      1
    ],
    [
      0,
      0,
      0,
      1
    ],
    [
      0,
      0,
      0,
      1
    ],
    [
      0,
      0,
      0,
      1
    ],
    [
      0,
      0,
      0,
      1
    ],
    [
      0,
      0,
      0,
      1
    ],
    [
      0,
      0,
      0,
      1
    ],
    [
      0,
      0,
      0,
      1
    ],
    [
      0,
      0,
      0,
      1
    ],
    [
      0,
      0,
      0,
      1
    ],
    [
      0,
      0,
      0,
      1
    ],
    [
      0,
      0,
      0,
      1
    ],
    [
      0,
      0,
      0,
      1
    ]
  ],
  "model_spec_sha256": "234a951c4e534b5ec7826907eaf2ee86d1d287f62e26e530b85e1dff5d44bd1d",
  "named_pose": "canonical-t",
  "tracked_source": null,
  "posed_surface_sha256": "caa66dff9b3625771c8f4c35bfe59556d30acdc3800880106f98f0ce75c49a95",
  "provenance": {
    "created_utc": "2026-09-04T01:09:37Z",
    "producer": "tatbot-human-representation-fixture",
    "source_sha256": "7ee9e277ac96eac49d2f9c7ae34ed43404b0103d5fe2196c75a5d2e8fa8c0726",
    "version": "1"
  },
  "schema": "tatbot.body-state/1",
  "tatbot_from_body": [
    [
      1,
      0,
      0,
      0
    ],
    [
      0,
      1,
      0,
      0
    ],
    [
      0,
      0,
      1,
      0
    ],
    [
      0,
      0,
      0,
      1
    ]
  ]
}
